{
  "format": "ccf.uplift-receipt/0.2.0",
  "receipt_id": "urn:ccf:receipt:12121212-1212-4212-8212-121212121212",
  "source_pack_id": "urn:ccf:pack:aaaaaaaa-aaaa-4aaa-8aaa-aaaaaaaaaaaa",
  "source_level": "ccf-exchange-v1",
  "destination_level": "ccf-verified-archive-v1",
  "destination_archive_id": "urn:ccf:archive:bbbbbbbb-bbbb-4bbb-8bbb-bbbbbbbbbbbb",
  "created_at": "2026-08-24T12:04:00.000Z",
  "status": "accepted",
  "objects": [
    {
      "object_kind": "record",
      "source_id": "urn:ccf:record:11111111-1111-4111-8111-111111111111",
      "source_submission_hash": "sha256:d22b63a855e0a2d6919c0884e50def65a23dcbfa1886ea510b5311f9bd62a02a",
      "canonical_id": "urn:ccf:record:11111111-1111-4111-8111-111111111111",
      "object_hash": "sha256:1111111111111111111111111111111111111111111111111111111111111111",
      "disposition": "admitted",
      "producer_authentication": "absent",
      "producer_proof": null,
      "archive_resolution": {"retention_profile": "payload_erasable"}
    },
    {
      "object_kind": "record",
      "source_id": "urn:ccf:record:22222222-2222-4222-8222-222222222222",
      "source_submission_hash": "sha256:06b2f34206dd053b64751f507d11e98ce20225bec93d916602245d39b0e20a88",
      "canonical_id": "urn:ccf:record:22222222-2222-4222-8222-222222222222",
      "object_hash": "sha256:2222222222222222222222222222222222222222222222222222222222222222",
      "disposition": "admitted",
      "producer_authentication": "absent",
      "producer_proof": null,
      "archive_resolution": {"retention_profile": "payload_erasable"}
    },
    {
      "object_kind": "record",
      "source_id": "urn:ccf:record:33333333-3333-4333-8333-333333333333",
      "source_submission_hash": "sha256:5d7bb83a000b668637d18bea6bba86e399b0c372aa91fbbb35f9734150af1b83",
      "canonical_id": "urn:ccf:record:33333333-3333-4333-8333-333333333333",
      "object_hash": "sha256:3333333333333333333333333333333333333333333333333333333333333333",
      "disposition": "admitted",
      "producer_authentication": "absent",
      "producer_proof": null,
      "archive_resolution": {"retention_profile": "payload_erasable"}
    },
    {
      "object_kind": "link",
      "source_id": "urn:ccf:link:44444444-4444-4444-8444-444444444444",
      "source_submission_hash": "sha256:388d9656e52c5d47e66e9d17d653f4f4fd796b2cacd45ca3fd43e0814140cbbe",
      "canonical_id": "urn:ccf:link:44444444-4444-4444-8444-444444444444",
      "object_hash": "sha256:4444444444444444444444444444444444444444444444444444444444444444",
      "disposition": "admitted",
      "producer_authentication": "absent",
      "producer_proof": null,
      "archive_resolution": {"retention_profile": "structural_retention_required"}
    },
    {
      "object_kind": "link",
      "source_id": "urn:ccf:link:55555555-5555-4555-8555-555555555555",
      "source_submission_hash": "sha256:183ee196f1a6c422253623298705076d205500cd882aec6ff5e7f2ceae51cf46",
      "canonical_id": "urn:ccf:link:55555555-5555-4555-8555-555555555555",
      "object_hash": "sha256:5555555555555555555555555555555555555555555555555555555555555555",
      "disposition": "admitted",
      "producer_authentication": "absent",
      "producer_proof": null,
      "archive_resolution": {"retention_profile": "structural_retention_required"}
    }
  ],
  "conflicts": [],
  "extensions": {}
}

